orig_span,hum_trans,goog_trans,deepl_trans,translator_name,time_period
"Bien te lo dige yo alma 
que esta vida toda es aire, 
bien te lo dige yo
y a fe que no es donaire.
La vida de este suelo 
cuando mas la queremos, 
mas presto la perdemos, 
porque se va de vuelo: 
pasase con su consuelo 
todo hecho aire:
bien te lo dige yo,
ya fe que no es donaire.
Vasele en un momento 
la vida al que peca, 
como la hoja seca
que se la lleva el viento:
porque su fundamento va 
todo sobre aire:
bien te lo dige yo,
ya fe que no es donaire.
Echemos siempre mano 
de lo que es perdurable, 
y no de lo deleznable
porque se pasa en vano: 
todo lo que es humano 
vasenos como aire:
bien te lo dige yo,
y a fe que no es donaire.","I told thee, soul, that joy and woe 
Were but a gust, a passing dew: 
I told thee so,-I told thee so, 
And, O my soul, the tale was true! 
This mortal life,-a fleeting thing,- 
When most we love it, swiftest flies; 
It passes like a shade and dies: 
And while it flaps its busy wing, 
It scatters every mist that lies 
Round human hopes,—all air and dew. 
I told thee so,-I told thee so, 
And, O my soul, the tale was true! 
Like the dry leaf that autumn's breath 
Sweeps from the tree, the mourning tree,- 
So swiftly and so certainly 
Our days are blown about by death:
 For life is built on vanity; 
Renewing days but death renew. 
I told thee so,—I told thee so,- 
And, O my soul, the tale was true! 
O, let us seize on what is stable, 
And not on what is shifting! All 
Rushes down life's vast waterfall, 
On to that sea interminable 
Which has no shore. Earth's pleasures pall; 
But heaven is safe, and sacred too. 
I told thee so, -I told thee so, - 
And, O my soul, the tale was true!","My soul tells you well
that this life is all air,
well I tell you
and by faith it is not a joke.
The life of this soil
when we love her the most,
the sooner we lose it,
because he's going on a flight:
pass with your consolation
everything made air:
I tell you well,
and faith that it is not grace.
See it in a moment
life to the one who sins,
like the dry leaf
that the wind takes it away:
because its foundation goes
all about air:
I tell you well,
and faith that it is not grace.
Let's always lend a hand
of what is lasting,
and not the despicable
because it is passed in vain:
everything that is human
vase us like air:
I tell you well,
and by faith it is not a joke.",,Sir John Bowring,baroque
"""¿Quieres hoy conversación, 
querida esposa?""—Sí quiero, 
esposo del corazón— 
""Pues en el jardín te espero. 
-¿A qué hora?—“A la oración.” 
“A la oración no me niego, 
que esta es la perfecta hora 
en que a las almas me entrego."" 
-¿Y si a la oración no llego? 
""Has por llegar a tal hora, 
goza tan buena ocasión, 
alma no quieres?""-Sí quiero, 
esposo del corazón. 
""Pues en el jardín te espero."" 
—¿A qué hora?—“A la oración. 
Si acaso te determinas 
en mi pecho hallarás 
jardín de flores divinas."" 
-¿Y alguna flor me darás?— 
""Darte he flores peregrinas, 
pero con tal condición 
que me has de querer.' -Sí quiero, 
esposo del corazón. 
""Pues en el jardín te espero."" 
-¿A qué hora?-""A la oración."" ","""Let's hold sweet converse, ere we part, 
Beloved fair!"" "" ""Tis sweet to be 
With thee, the husband of my heart!"" 
""I'll in the garden wait for thee.” 
""When?"" ""At the sacred vesper-bell.” 
""That is the hour in which I dwell 
Within the souls I love, and there 
Fill the pure shrine with praise and prayer."" 
""But if, when dawns the vesper hour, 
I should be absent—” “Nay, my soul! 
Lose not the holy, hallowing power 
Of evening's serene control!"" 
""I'll come;-that hour shall not depart 
Without thy smile who holdest my 
""I'll in the garden wait for thee."" 
""When?"" ""At the sacred vesper-bell. 
""Yes, come! O come!-my breast shall be 
A garden of fair flowers for thee, 
Where thou the fairest flowers shalt cull."" 
""And wilt thou give a flower to me?” 
""Yes! flowers more bright, more beautiful, 
Than ever in earth's gardens grew, 
If thou wilt trust and love me too.""
""Yes! I will trust and love thee well."" 
""I'll in the garden wait for thee."" 
""When?"" ""At the sacred vesper-bell.”","""Do you want conversation today,
dear wife?""—Yes I do,
husband of the heart—
""Well, I'll wait for you in the garden.
-What time?—“To prayer.”
“I do not refuse prayer,
that this is the perfect time
in which I give myself to souls.""
-What if I don't get to prayer?
""You have to arrive at such an hour,
enjoy such a good opportunity,
Soul, don't you want?"" -Yes, I do,
husband of the heart.
""Well, I'll wait for you in the garden.""
—At what time?—“To prayer.
If you decide
in my chest you will find
garden of divine flowers.""
-And will you give me some flowers?—
""I give you pilgrim flowers,
but with such condition
that you must love me.' -Yes I want,
husband of the heart.
""Well, I'll wait for you in the garden.""
-What time?-""To prayer.""",,Sir John Bowring,baroque
"Amor, tú que las almas ves desnudas, 
cuéntanos el desdén i la osadía 
con que la hermosa Filis resistía 
a tus doradas flechas más agudas. 
I dinos las razones i las dudas 
con que, después de herida, se encubría; 
si sobervia o vergüenza detenía 
lo que mostravan apariencias mudas. 
Lo que nosotros vimos acá fuera 
fue colorearse el rostro como rosa, 
i huir de nuestros ojos sus dos soles; 
cual suele Phebo al fin de su carrera, 
robando su color a cada cosa, 
las nubes adornar con arreboles. ","Thou, Love, by whom the naked soul is viewed, 
Recount to us, with what disdains and heart 
Of proof could Phyllis (with such form endued) 
Resist so long thy sharpest golden dart. 
And those close doubts, and struggling reasons show, 
With which being vanquished she her wound concealed. 
If it were Pride or Shame, which made her so 
Deny with language, what dumb shows revealed. 
What we without could see, was that her face 
Like blushing Rose put on a crimson dye; 
And her eyes hid themselves with bashful grace, 
Like languishing Apollo, drawing nigh 
His race's end; when his bright beams he shrouds, 
And, with vermilion flakes, adorns the clouds. ","Love, you who see souls naked,
tell us the disdain and the daring
with which the beautiful Philis resisted
to your sharpest golden arrows.
Tell us the reasons and the doubts
with which, after being wounded, he covered himself;
If pride or shame stopped
which showed mute appearances.
What we saw out here
was to color her face like a rose,
and flee from our eyes its two suns;
as Phebo usually does at the end of his career,
stealing its color from everything,
the clouds adorn with reds.",,Sir Richard Fanshawe,baroque
"Yo os quiero confesar, don Juan, primero: 
que aquel blanco y color de doña Elvira 
no tiene de ella más, si bien se mira, 
que el haberle costado su dinero. 
Pero tras eso confesaros quiero 
que es tanta la beldad de su mentira 
que en vano a competir con ella aspira 
belleza ygual de rostro verdadero. 
Mas, ¿qué mucho que yo perdido ande 
por un engaño tal, pues que sabemos 
que nos engaña así Naturaleza? 
Porque ese cielo azul que todos vemos 
ni es cielo ni es azul: ¡Lástima grande 
que no sea verdad tanta belleza! 
","I must confess, Don Juan, on due inspection, 
That dame Elvira's charming red and white, 
Though fair they seem, are only hers by right, 
In that her money purchased their perfection; 
But thou must grant as well, on calm reflection, 
That her sweet lie hath such a luster bright, 
As fairly puts to shame the paler light, 
And honest beauty of a true complexion! 
And yet no wonder I distracted go 
With such deceit, when 'tis within our ken 
That nature blinds us with the self-same spell; 
For that blue heaven above that charms us so, 
Is neither heaven nor blue! Sad pity then 
That so much beauty is not truth as well. ","I want to confess to you, don Juan, first:
that that white and color of Doña Elvira
It has nothing more of it, if you look closely,
than having cost him his money.
But after that I want to confess to you
that the beauty of his lie is so much
that in vain aspires to compete with her
equal beauty with a true face.
But how much am I lost?
for such a deception, since we know
What does Nature deceive us like this?
Because that blue sky that we all see
It is neither sky nor blue: What a great shame
May it not be true so much beauty!
",,James Young Gibson,baroque
"¡O tú, siempre dichosa pecadora, 
la que fuiste por tal con grande espanto 
del vulgo con el dedo señalada!, 
tus lágrimas con Christo pueden tanto, 
que la menor lo enciende i enamora, 
i a la culpa mayor dexa anegada. 
Tú quedas en apóstol transformada, 
i de ignorante i mala, santa i sabia. 
No es mucho que la zarza en flor se mude 
i que el álamo sude 
en competencia de la mirra arabia, 
i que cuando de yerba al campo priva, 
la mies en abundancia se recoja. 
Venid a ver de rosas i azucenas 
las montañas estériles más llenas, 
i un árbol seco revestido de hoja. 
La planta antes inútil Dios cultiva; 
regada en su jardín con agua viva, 
es fructífera ya, i sus ramas bellas 
tocan continuamente en las estrellas. 
","Blessed, yet sinful one, and broken-hearted! 
The crowds are pointing at the thing forlorn, 
In wonder and in scorn! 
Thou weepest days of innocence departed; 
Thou weepest, and thy tears have power to move 
The Lord to pity and love. 
The greatest of thy follies is forgiven, 
Even for the least of all the tears that shine 
On that pale cheek of thine. 
Thou didst kneel down to Him who came from heaven, 
Evil and ignorant, and thou shalt rise 
Holy, and pure, and wise. 
It is not much that to the fragrant blossom 
The ragged brier should change; the bitter fir 
Distill Arabian myrrh; 
Nor that, upon the wintry desert's bosom, 
The harvest should rise plenteous, and the swain 
Bear home the abundant grain. 
But come and see the bleak and barren mountains 
Thick to their tops with roses; come and see 
Leaves on the dry, dead tree: 
The perished plant, set out by living fountains, 
Grows fruitful, and its beauteous branches rise 
For ever towards the skies.","O you, ever blessed sinner,
the one you were for such with great fear
of the vulgar with the finger pointed!,
your tears with Christo can do so much,
that the youngest turns him on and falls in love,
and the greater guilt leaves flooded.
You remain a transformed apostle,
I'm ignorant and I'm bad, I'm holy and I'm wise.
It's not long for the flowering bramble to move
and let the poplar sweat
in competition with Arabian myrrh,
And when the field is deprived of grass,
the harvest is gathered in abundance.
Come see roses and lilies
the fullest barren mountains,
i a dry tree covered in leaves.
The previously useless plant God cultivates;
watered in his garden with living water,
It is already fruitful, and its branches are beautiful
They continually play on the stars.
",,William Cullen Bryant,baroque
"El hombre fue de dos principios hecho, 
tales, que, con jactancia verdadera, 
a sus ojos le alega cualquier fiera 
i cualquier planta parentesco estrecho. 
Pero cuando él reconozió en su pecho 
la gran porción del fuego de la esfera, 
vio, con admiración de ver lo que era, 
que a la divinidad tiene derecho. 
Haz, pues, que, con trocado ministerio, 
a la vaga altivez del albedrío 
el sentido inferior la tienda redes. 
I cuando él pretendiere, o Fabio mío, 
hazerte siervo, acuérdate que puedes
mirar essas estrellas con imperio.","There are two principles in man that strive 
For ever for the mastery: he is bound 
Even to the vilest reptiles on the ground, 
And to the meanest plant or flower alive; 
Yet he has glory struggling in his breast- 
Glory that has its fountain-source above: 
He stands erect in majesty and love, 
And power, and joy, and feels that he is blest. 
Let him beware, then, that his earthly part 
Bend not his heavenly to its narrow sphere, 
Nor cloud with darkness this his mortal state; 
And, if he faint a moment, let his heart 
Find comfort in the thought—that even here 
He may the stars sublimely contemplate! ","Man was made of two principles,
such that, with true boasting,
In his eyes any beast claims
i any closely related plant.
But when he recognized in his chest
the great portion of the fire of the sphere,
He saw, with admiration to see what it was,
that he has a right to divinity.
Make then, with changed ministry,
to the vague arrogance of will
the lower sense the store networks.
And when he wants, or my Fabio,
make yourself a servant, remember that you can
look at those stars with empire.",,Sir John Bowring,baroque
"""Dime, Padre común, pues eres justo, 
¿por qué ha de permitir tu providencia, 
que, arrastrando prisiones la innocencia, 
suba la fraude a tribunal augusto? 
¿Quién de fuerzas al brazo, que robusto 
haze a tus leyes firme resistencia, 
i que el zelo, que más las reverencia, 
gima a los pies del venzedor injusto? 
Vemos que vibran vitoriosas palmas 
manos inicias, la virtud gimiendo 
del triunfo en el injusto regocijo."" 
Esto dezía yo, cuando, riendo, 
celestial nimfa aparezió, i me dijo: 
""¡Ciego!, ¿es la tierra el centro de las almas?""","Tell me, Thou common Father,―tell me why, 
(Since thou art just and good) dost thou permit 
Successful fraud, securely throned, to sit, 
While innocence, oppress'd, stands weeping by? 
Why hast thou nerved that strong arm to oppose 
Thy righteous mandates with impunity,
While the meek man who served and reverenced Thee 
Lies at the feet of Thine and virtue's foes? 
Why (said I, in despair) should vice confound
All nature's harmony, and tower above 
In all the pomp, and pride, and power of state? 
Then I look'd upwards,—and I heard a sound 
As from an angel, smiling through heaven's gate, 
""Is earth a spot for heaven-born souls to love?""","""Tell me, common Father, for you are just,
why should your providence allow,
that, dragging innocence prisons,
upload the fraud to the august court?
Who gives strength to the arm, how robust
make firm resistance to your laws,
and that zeal, which reveres them most,
groan at the feet of the unjust victor?
We see victorious palms vibrating
you start hands, virtue moaning
of triumph in unjust rejoicing.""
This is what I said, when, laughing,
heavenly nymph appeared, and told me:
""Blind! Is the earth the center of souls?""",,Sir John Bowring,baroque
"Quita ese afeite, O Lais, que se azeda, 
y el mismo en el olor su fraude acusa, 
déjanos ver tu rostro, y si rehusa 
el despegarse, quítalo con greda. 
Que tirano la ley natural veda, 
o que muertas el diestro acero atusa, 
que alegren más que la beldad confusa 
de bosque inculto, o bárbara arboleda. 
Si lo blanco, y purpúreo, que reparte 
Dios con sus rosas, puso en tus mejillas 
con no imitable natural mixtura, 
¿por qué con dedo ingrato las mancillas? 
O Lais no más que en perfección tan pura 
arte ha de ser el despreciar el arte. ","Nay cleanse this filthy mixture from thy hair, 
And give the untricked tresses to the gale! 
The sun, as lightly on the breeze they sail, 
Shall gild thy bright brown locks! thy cheek is fair, 
Away then with this artificial hue, 
This blush eternal! To the human face 
Nature has given no imitable grace. 
Why these black spots obtruding on the view 
Of lily cheek? and these ear-jewels too 
That ape the barbarous Indian's vanity? 
Nor Lady! need that necklace there invite 
The prying eye-we know thy neck is white: 
Go to thy dressing-room again, and be 
Artful enough to learn simplicity.","Take away that shave, O Lais, it gets dirty,
and he himself accuses his fraud in the smell,
let us see your face, and if you refuse
If it comes off, remove it with clay.
What a tyrant the natural law prohibits,
or that dead the skillful steel sharpens,
that cheer more than the confused beauty
of uncultivated forest, or barbaric grove.
If the white, and purple, that distributes
God with his roses, put on your cheeks
with no imitable natural mixture,
Why do the stains with an ungrateful finger?
O Lais no more than in perfection so pure
art must be to despise art.",,Robert Southey,baroque
"Fabio, las esperanzas no son malas; 
mas tú con tanto aplauso las acetas, 
que a oráculos forzosos de profetas, 
i aun a vivos efetos, las igualas. 
Sabe que contra el Tiempo se arma Palas, 
contra sus inconstancias i sus tretas; 
que él es tal, que tropieza en sus muletas, 
cuando le piden que use de sus alas. 
I assí nunca en el término futuro, 
ni en el presente (si eres sabio) digas 
que hay tiempo que del tiempo esté seguro; 
que cuando a fuerza de sufrir le obligas 
a que acuda fïel, te pone un muro 
de presto entre la hoz y las espigas.","To hope is good, but with such wild applause 
Each promise Fabius thou dost entertain; 
As if decreed thee by Fate certain laws, 
Or in possession now it did remain. 
Wisdom is armed 'gainst all that can succeed, 
Time's changes and his stratagems: For such 
His nature is, that when his wings we need 
He will come creeping on his halting crutch. 
Do not, if wise, then to thyself assure 
The future, nor on present goods rely, 
Or think there's any time from time secure: 
For then when Patience sees her Harvest nigh, 
That mocking Tyrant in an instant rears 
A wall between the sickle and the ears. ","Fabio, hopes are not bad;
but you with so much applause the acetas,
than to forced oracles of prophets,
and even to live effects, you equal them.
He knows that Pallas arms himself against Time,
against his inconstancy and his tricks;
that he is such that he stumbles on his crutches,
when they ask him to use his wings.
I so never in the future term,
nor in the present (if you are wise) say
that there is time when I am sure of time;
that when by dint of suffering you force him
for the faithful to come, it puts a wall on you
quickly between the sickle and the ears.",,Sir Richard Fanshawe,baroque
"Ya el oro natural crespes o extiendas, 
o a componerlo con industria aspires, 
lucir sus lazos o sus ondas mires, 
cuando libre a tus damas lo encomiendas; 
o ya, por nueva ley de Amor, lo prendas 
entre ricos diamantes y zafires, 
o bajo hermosas plumas lo retires, 
y el traje varonil fingir pretendas, 
búscate Adonis por su Venus, antes 
por su Adonis te tiene ya la diosa, 
y a entrambos los engañan tus cabellos; 
mas yo, en la misma duda milagrosa, 
mientras se hallan en ti los dos amantes, 
muero por ambos y de celos de ellos.","Whether thou curl, or braid thy native gold, 
And workst it pliant into every forme, 
Or leavst it by thy maids to be unrolled, 
Falling about thy neck like Danae's storme: 
Or whether richly 'tis enamellèd 
With cheerful emeralds, and blue sapphire veins, 
Or crowned with tossing plumes, which hide thy head, 
Hunting the hart over the shining plains, 
Venus mistakes thee for her rural Lover, 
Whom late Adonis for his Venus tooke; 
Whilst change of dresses doth by turns discover 
A lovely swain, and goddess in thy looke. 
But I, to whom they both united seeme, 
In love with her, grow jealous straight of him. ","Whether you crepe or extend the natural gold,
or to compose it with industry aspires,
show off your ties or your mire waves,
When I free your ladies you commend it;
or now, by new law of Love, you wear it
between rich diamonds and sapphires,
or under beautiful feathers you remove it,
and the manly suit pretends to pretend,
look for Adonis for his Venus, before
The goddess already has you for her Adonis,
and your hair deceives both of you;
but I, in the same miraculous doubt,
while the two lovers are in you,
I die for both of them and from jealousy of them.",,Sir Richard Fanshawe,baroque
"Si mil almas tuviera con que amaros, 
dellas todas en vos hiciera empleo. 
Si el otro fuera igual a mi deseo 
pensara tener poco para daros. 
Quisiera un Argos ser para miraros, 
para conmigo uniros un Briarco, 
para tañeros gustos, otro Orfeo, 
y otro Homero mejor para cantaros. 
Fuera el Mayo en belleza por vestiros, 
en fuego el amor mismo por quereros, 
la fama en lenguas por mi amor deciros. 
Sol, para con sus rayos defenderos 
del mundo, Rey para con el serviros, 
y cielo para siempre poseeros","Had I a thousand souls with which to love thee, 
I'd throw them all, delighted, at thy feet; 
Had I uncounted gold wherewith to move thee, 
'Twould seem unworthy all, and incomplete: 
I fain would be an Argus but to view thee, 
And a Briareus round thy charms to cling; 
Another Orpheus to play music to thee, 
A Homer thy perfections all to sing. 
I would be May, to clothe thee with its splendour, 
And Love itself adoring to caress thee; 
I'd call on fame, to speak my passion tender, 
I'd fain be the world's king, to serve and bless thee, 
A sun to be thy light and thy defender, 
And heaven itself for ever to possess thee. ","If a thousand souls had to love you,
all of them made use of you.
If the other were equal to my desire
I thought I had little to give you.
I would like an Argos to be to look at you,
to join me in a Briarco,
for tañeros tastes, another Orpheus,
and another better Homer to sing to you.
Out with May in beauty to dress yourselves,
love itself on fire for loving you,
fame in tongues for my love tell you.
Sun, to defend you with its rays
of the world, King to serve you,
and heaven forever possess you",,Sir John Bowring,baroque
"Ayer naciste, y morirás mañana. 
¿Para tan breve ser, quién te dio vida? 
¿Para vivir tan poco estás lucida, 
y para no ser nada estás lozana? 
Si te engañó tu hermosura vana, 
bien presto la verás desvanecida 
porque en tu hermosura está escondida 
la ocasión de morir muerte temprana. 
Cuando te corte la robusta mano, 
ley de la agricultura permitida, 
grosero aliento acabará tu suerte. 
No salgas, que te aguarda algún tirano; 
dilata tu nacer para tu vida, 
que anticipas tu ser para tu muerte.","Blown in the morning, thou shalt fade ere noon, 
What boots a life which in such haste forsakes thee? 
Thou'rt wondrous frolic, being to die so soon, 
And passing proud a little colour makes thee. 
If thee thy brittle beauty so deceives, 
Know then the thing that swells thee is thy bane; 
For the same beauty doth, in bloody leaves, 
The sentence of thy early death contain. 
Some clown's coarse lungs will poison thy sweet flower, 
If by the careless plough thou shalt be torn; 
And many Herods lie in wait each hour 
To murder thee as soon as thou art born- 
Nay, force thy bud to blow—their tyrant breath 
Anticipating life, to hasten death! ","You were born yesterday, and you will die tomorrow.
For such a brief being, who gave you life?
To live so little are you bright,
and to be nothing are you fresh?
If your vain beauty deceived you,
very soon you will see it faded
because it is hidden in your beauty
the chance to die an early death.
When I cut off your strong hand,
permitted agriculture law,
rude encouragement will end your luck.
Don't go out, because some tyrant awaits you;
dilate your birth for your life,
that you anticipate your being for your death.",,Sir Richard Fanshawe,baroque
"Lugar te da sublime el vulgo ciego, 
verde ya pompa de la selva obscura; 
que no sin arte religión impura 
aras te destinó, te hurtó al fuego. 
Mudo mil veces yo la deidad niego, 
no el esplendor a tu materia dura; 
ídolos a los troncos la esculptura, 
dioses hace a los ídolos el ruego. 
En lenguas mil de luz, por tantas de oro 
fragrantes bocas el humor sabeo 
te aclama, ilustremente suspendido. 
En tus desnudos hoy muros ignoro 
cuántas de grato señas te deseo, 
leño al fin con lisonjas desmentido.","Thee, senseless Stock, because th'art richly guilt, 
The blinded people without cause admire, 
And Superstition impiously hath built 
Altars to that which should have beene the fire. 
Nere shall my tongue consent to worship thee, 
Since all's not Gold that glistens and is faire; 
Carving but makes an Image of a Tree: 
But Gods of Images are made by Prayer. 
Sabean Incense in a fragrant Cloud 
Illustriously suspended o'er thy Crowne 
Like a King's Canopy, makes thee allowed 
For more than man. But let them take thee downe, 
And thy true value be once understood, 
Thy dull Idolaters will finde th'art wood.","The blind crowd gives you a sublime place,
green and pomp of the dark jungle;
that not without art impure religion
Aras destined you, he stole you from the fire.
Mute a thousand times I deny the deity,
not the splendor to your hard matter;
idols to the trunks the sculpture,
gods make prayer to idols.
In languages ​​a thousand of light, for so many of gold
fragrant mouths the Sabean humor
hails you, illustrious suspended.
In your naked walls today I ignore
how many pleasant signs I wish for you,
log at last with flattery denied.",,Sir Richard Fanshawe,baroque
