orig_span,hum_trans,goog_trans,deepl_trans,translator_name,time_period
"Si solamente me tocaras el corazón, 
si solamente pusieras tu boca en mi corazón, 
tu fina boca, tus dientes, 
si pusieras tu lengua como una flecha roja 
allí donde mi corazón polvoriento golpea, 
si soplaras en mi corazón, cerca del mar, llorando, 
sonaría con un ruido oscuro, con sonido de ruedas de tren con sueño, 
como aguas vacilantes, 
como el otoño en hojas, 
como sangre, 
con un ruido de llamas húmedas quemando el cielo, 
soñando como sueños o ramas o lluvias, 
o bocinas de puerto triste, 
si tú soplaras en mi corazón, cerca del mar, 
como un fantasma blanco, 
al borde de la espuma, 
en mitad del viento, 
como un fantasma desencadenado, a la orilla del mar, llorando. 
Como ausencia extendida, como campana súbita, 
el mar reparte el sonido del corazón, 
lloviendo, atardeciendo, en una costa sola: 
la noche cae sin duda, 
y su lúgubre azul de estandarte en naufragio 
se puebla de planetas de plata enronquecida. 
Y suena el corazón como un caracol agrio, 
llama, oh mar, oh lamento, oh derretido espanto 
esparcido en desgracias y olas desvencijadas: 
de lo sonoro el mar acusa 
sus sombras recostadas, sus amapolas verdes. 
Si existieras de pronto, en una costa lúgubre, 
rodeada el día muerto, 
por frente a una nueva noche, 
llena de olas, 
y soplaras en mi corazón de miedo frío, 
soplaras en la sangre sola de mi corazón, 
soplaras en su movimiento de paloma con llamas, 
sonarían sus negras sílabas de sangre, 
crecerían sus incesantes aguas rojas, 
y sonaría, sonaría a sombras, 
sonaría como la muerte, 
llamaría como un tubo lleno de viento o llanto, 
o una botella echando espanto a borbotones. 
Así es, y los relámpagos cubrirían tus trenzas 
y la lluvia entraría por tus ojos abiertos 
a preparar el llanto que sordamente encierras, 
y las alas negras del mar girarían en torno 
de tí, con grandes garras, y graznidos, y vuelos. 
Quieres ser el fantasma que sople, solitario, 
cerca del mar su estéril, triste instrumento? 
Si solamente llamaras, 
su prolongado son, su maléfico pito, 
su orden de olas heridas, 
alguien vendría acaso, 
alguien vendría, 
desde las cimas de las islas, desde el fondo rojo del mar, 
alguien vendría, alguien vendría. 
Alguien vendría, sopla con furia, 
que suene como sirena de barco roto, 
como lamento, 
como un relincho en medio de la espuma y la sangre 
como un agua feroz mordiéndose y sonando. 
En la estación marina 
su caracol de sombra circula como un grito, 
los pájaros del mar lo desestiman y huyen, 
sus listas de sonido, sus lúgubres barrotes 
se levantan a orillas del océano solo. ","If only you would touch my heart,
if only you would put your mouth on my heart, 
your delicate mouth, your teeth,
if you would put your tongue like a red arrow 
there where my dusty heart beats,
if you would blow on my heart, near the sea, weeping, 
it would sound with a dark noise, with the sound of sleepy train wheels, 
like wavering waters, like a leafy autumn,
like blood,
with a noise of moist flames burning the sky, 
dreaming like dreams or branches or rains, 
or foghorns in a dreary port,
if you would blow on my heart, near the sea, 
like a white ghost,
at the edge of the foam, i
n the midst of the wind,
like an unchained ghost, at the edge of the sea, weeping.
Like an extended absence, like a sudden bell, 
the sea spreads the sound of the heart, 
raining, at nightfall, on a lonely coast:
night doubtless falls,
and its mournful shipwrecked-banner blue 
peoples itself with planets of hoarse silver.
And the heart sounds like a sour snail, 
call, oh sea, oh lament, oh melted fright
scattered in misfortunes and rickety waves: 
from resonance the sea reveals
its recumbent shadows, its green poppies.
If you suddenly existed, on a gloomy coast, 
surrounded by the dead day,
facing a new night, filled with waves,
and if you blew on my heart cold with fear, 
you blew on its flaming dove movement,
its black bloody syllables would sound, 
its incessant red waters would swell, 
and it would sound, sound of shadows 
sound like death,        '
it would call like a tube filled with wind or weeping, 
or a bottle squirting fright in spurts.
So it is, and the lightning would cover your tresses 
and the rain would enter through your open eyes 
to prepare the weeping that you silently enclose, 
and the black wings of the sea would wheel around 
you, with great claws, and croakings, and flights.
Do you want to be the solitary ghost that near the sea 
plays upon its sad and sterile instrument?
If only you would call,
its prolonged sound, its malevolent whistle, 
its arrangement of wounded waves,
someone would perhaps come, someone would come.
from the peaks of the islands, from the red depths of the sea,
someone would come, someone would come.
Somebody would come; play furiously,
let it sound like the siren of a broken boat, 
like a lament,
like a whinny in the midst of the foam and the blood, 
like a ferocious water gnashing and echoing.
In the sea season
its snail of shadow circles like a shout, 
the sea birds belittle it and fly away,
its roll call of sounds, its mournful crosspieces, 
rise on the shore of the solitary sea.
","If only you would touch my heart,
If only you would put your mouth on my heart,
your fine mouth, your teeth,
If you put your tongue like a red arrow
there where my dusty heart knocks,
If you blew into my heart, near the sea, crying,
It would ring with a dark noise, with the sound of sleepy train wheels,
like wavering waters,
like autumn in leaves,
like blood,
with a noise of wet flames burning the sky,
dreaming like dreams or branches or rains,
or sad harbor horns,
If you would blow in my heart, near the sea,
like a white ghost,
on the edge of the foam,
in the middle of the wind,
like an unchained ghost, on the seashore, crying.
Like an extended absence, like a sudden bell,
the sea distributes the sound of the heart,
raining, dusk, on a lonely coast:
the night falls without a doubt,
and its gloomy blue as a shipwrecked banner
It is populated with planets of hoarse silver.
And the heart sounds like a sour snail,
flame, oh sea, oh lament, oh melted horror
scattered in misfortunes and rickety waves:
of the sound the sea accuses
its reclining shadows, its green poppies.
If you suddenly existed, on a gloomy shore,
surrounded by the dead day,
facing a new night,
full of waves,
and you will blow into my heart of cold fear,
you will blow into the lonely blood of my heart,
you will blow in its movement like a dove with flames,
its black syllables of blood would sound,
its incessant red waters would grow,
and it would sound, it would sound like shadows,
It would sound like death,
I would call like a tube full of wind or tears,
or a bottle gushing horror.
That's right, and the lightning would cover your braids
and the rain would enter through your open eyes
to prepare the tears that you deafly contain,
and the black wings of the sea would revolve around
of you, with great claws, and squawks, and flights.
Do you want to be the ghost that blows, lonely,
near the sea your sterile, sad instrument?
If you only called,
its prolonged sound, its evil whistle,
his order of wounded waves,
maybe someone would come,
someone would come,
from the tops of the islands, from the red bottom of the sea,
someone would come, someone would come.
Someone would come, blow with fury,
that sounds like a broken ship's siren,
as I regret,
like a neigh in the midst of foam and blood
like fierce water biting and sounding.
At the marine station
its snail of shadow circulates like a scream,
The birds of the sea reject him and flee,
its sound lists, its gloomy bars
They rise on the shores of the ocean alone.",,Donald D. Walsh,twentieth_cent
"Un enlutado día cae de las campanas 
como una temblorosa tela de vaga viuda, 
es un color, un sueño 
de cerezas hundidas en la tierra, 
es una cola de humo que llega sin descanso 
a cambiar el color del agua y de los besos. 
No sé si se me entiende: cuando desde lo alto 
se avecina la noche, cuando el solitario poeta 
a la ventana oye correr el corcel del otoño 
y las hojas del miedo pisoteado crujen en sus arterias, 
hay algo sobre el cielo, como lengua de buey 
espeso, algo en la duda del cielo y de la atmósfera. 
Vuelven las cosas a su sitio, 
el abogado indispensable, las manos, el aceite, 
las botellas, 
todos los indicios de la vida: las camas, sobre todo, 
están llenas de un líquido sangriento, 
la gente deposita sus confianzas en sórdidas orejas, 
los asesinos bajan escaleras, 
pero no es esto, sino el viejo galope, 
el caballo del viejo otoño que tiembla y dura. 
El caballo del viejo otoño tiene la barba roja 
y la espuma del miedo le cubre las mejillas 
y el aire que le sigue tiene forma de océano 
y perfume de vaga podredumbre enterrada. 
Todos los días baja del cielo un color ceniciento 
que las palomas deben repartir por la tierra: 
la cuerda que el olvido y las lágrimas tejen, 
el tiempo que ha dormido largos años dentro de las campanas, 
todo, 
los viejos trajes mordidos, las mujeres que ven venir la nieve, 
las amapolas negras que nadie puede contemplar sin morir, 
todo cae a las manos que levanto 
en medio de la lluvia. 
","A day in mourning falls from the bells 
like a trembling vague-widow cloth,
it is a color, a dream
of cherries buried in the earth,
it is a tail of smoke that restlessly arrives
to change the color of the water and the kisses.
I do not know if I make myself clear: when from on high 
night approaches, when the solitary poet
at the window hears autumn's steed running
and the leaves of trampled fear rustle in his arteries,
there is something over the sky, like the tongue of a thick 
ox, something in the doubt of the sky and the atmosphere.
Things return to their places,
the indispensable lawyer, the hands, the olive oil, 
the bottles,
all the traces of life: the beds above all 
are filled with a bloody liquid,
people deposit their confidences in sordid ears, 
assassins go down stairs,
it1s not this, however, but the old gallop,
the horse of the old autumn that trembles and endures.
The horse of the old autumn has a red beard 
and the foam of fear covers its cheeks
and the air that follows it is shaped like an ocean 
and a perfume of vague buried putrefaction.
Every day down from the sky comes an ashen color 
that doves must spread over the earth:
the cord that forgetfulness and weeping weave, 
time that has slept long years within the bells,
everything,	.
the old tattered suits, the women who see snow coming, 
the black poppies that no one can look at without dying, 
everything falls into the hands that I lift
in the midst of the rain.
","A mournful day falls from the bells
like a trembling fabric of a lazy widow,
It's a color, a dream
of cherries sunk in the ground,
It is a tail of smoke that arrives without rest
to change the color of the water and the kisses.
I don't know if you understand me: when from above
The night is approaching, when the lonely poet
at the window he hears the autumn steed running
and the leaves of trampled fear creak in their arteries,
There is something about the sky, like an ox's tongue
thick, something in the doubt of the sky and the atmosphere.
Things return to their place,
the indispensable lawyer, the hands, the oil,
The bottles,
all the signs of life: the beds, above all,
They are filled with a bloody liquid,
People put their trust in sordid ears,
The murderers go down stairs,
but it is not this, but the old gallop,
the horse of the old autumn that trembles and lasts.
Old man autumn's horse has a red beard
and the foam of fear covers his cheeks
and the air that follows is shaped like an ocean
and perfume of vague buried rot.
Every day an ashen color falls from the sky
that the doves must distribute over the earth:
the rope that oblivion and tears weave,
the time that has slept long years inside the bells,
all,
the old worn-out suits, the women who see the snow coming,
the black poppies that no one can contemplate without dying,
everything falls to the hands that I raise
in the middle of the rain.
",,Donald D. Walsh,twentieth_cent
"Frente al blanco gris del cerro, 
a par del río, la ruta 
divisa con ansiedad 
álamos, perfil de lluvia. 
Junto a las trémulas hojas 
alguien, solitario nunca, 
habla a solas con el río. 
¿Álamos de brisa y musa? 
Mansamente el río traza 
su recreo curva a curva 
mientras en leve temblor
los álamos se dibujas, 
y tan verdes como el río 
follaje a follaje arrullan 
al dichoso de escuchar 
álamos de casi música. 
¡Dichoso por la ribera 
quien sigue el río que aguza 
la compañía en el agua, 
en los álamos la fuga! 
","Facing the gray white hill 
At river level, the road 
Anxiously perceives poplars 
The profile of rain.
Beside the trembling leaves 
Someone, never by himself, 
Speaks alone to the river.
Poplars of wind and poetry?
Gently the river strings out
Its playfulness curve after curve 
While in a slight tremor the poplars 
Are sketched on the water.
And as green as the river
Body after body of leaves they lull 
The one who is lucky enough to hear 
Poplars that are almost music.
Lucky upon the bank
Is the man who follows the river 
That sharpens the water's company
And the poplars' flight.","In front of the white gray of the hill,
next to the river, the route
currency with anxiety
poplars, rain profile.
Next to the trembling leaves
someone, never alone,
talk alone with the river.
Poplars of breeze and muse?
Meekly the river traces
your recreation curve by curve
while in slight tremor
the poplars are drawn,
and as green as the river
foliage to foliage lull
to the happy one to listen
poplars of almost music.
Happy by the shore
who follows the river that sharpens
the company in the water,
in the poplars the escape!
",,John A. Crow,twentieth_cent
"¡Oh luna! ¡Cuánto abril! 
¡Qué vasto y dulce el aire! 
Todo lo que perdí 
volverá con las aves. 
Sí, con las avecillas 
que en coro de alborada 
pían y pían, pían 
sin designio de gracia. 
La luna está muy cerca, 
quieta en el aire nuestro. 
El que yo fui me espera 
bajo mis pensamientos. 
Cantará el ruiseñor 
en la cima del ansia. 
¡Arrebol, arrebol 
entre el cielo y las auras! 
¿Y se perdió aquel tiempo 
que yo perdí? La mano 
dispone, dios ligero, 
de esta luna sin año. 
","Oh, moon! So many Aprils! 
How wide and sweet the air! 
All that I have lost
Returns with the winging birds.
Yes, with the little birds
That make at dawn a chorus 
Of endless twittering,
Their unpremeditated art.
The moon is very near, 
Silent and still the air.
The man I used to be waits for me 
Beneath these thoughts.
At the crest of my pain 
The nightingale will sing; 
There are red embers
Between the sky and its gold.
The time I have lost,
Is it all gone? The hand 
Disposes, like a fickle god, 
Of this ageless moon.
","Oh moon! How much April!
How vast and sweet the air!
everything i lost
will return with the birds.
Yes, with the birds
that in a chorus of dawn
they chirp and chirp, chirp
without a plan of grace.
The moon is very close,
still in our air.
The one I was is waiting for me
under my thoughts.
The nightingale will sing
at the peak of craving.
Arrebol, arrebol
between the sky and the auras!
And was that time lost?
What did I lose? Hand
dispose, light god,
of this yearless moon.
",,John A. Crow,twentieth_cent
"Tuércele el cuello al cisne de engañoso plumaje 
que da su nota blanca al azul de la fuente; 
él pasea su gracia no más, pero no siente 
el alma de las cosas ni la voz del paisaje. 
Huye de toda forma y de todo lenguaje 
que no vayan acordes con el ritmo latente 
de la vida profunda... y adora intensamente 
la vida, y que la vida comprenda tu homenaje. 
Mira al sapiente buho cómo tiende las alas 
desde el Olimpo, deja el regazo de Palas 
y posa en aquel árbol el vuelo taciturno... 
El no tiene la gracia del cisne, mas su inquieta 
pupila que se clava en la sombra, interpreta 
el misterioso libro del silencio nocturno. ","Go twist the neck of the deceptive swan
Whose white on the blue fountain seems unreal; 
The swan that moves in grace, but cannot feel
The soul of things, or hear the earth's sweet song.
Flee all conceits of language and of style, 
Seek only rhythms that will beat at one
With life's own heart. Revere what life has done!
Let life accept your homage and your smile.
See how the sapient owl extends his wings 
From Pallas' lap on his Olympian arc
Till on that tree he ends his noiseless flight. 
Here is no graceful swan, no bird that sings, 
But his disquieting eye pierces the dark
And plumbs the silent manuscript of night.","Twist the neck of the swan with deceptive plumage
that gives its white note to the blue of the fountain;
he walks his grace no more, but he does not feel
the soul of things nor the voice of the landscape.
Flee from all forms and all language
that do not go in accordance with the latent rhythm
of deep life... and worships intensely
life, and may life understand your tribute.
Look at the wise owl as it spreads its wings
From Olympus, leave the lap of Pallas
and the taciturn flight perches on that tree...
He does not have the grace of the swan, but his restlessness
pupil that is stuck in the shadow, interprets
the mysterious book of nocturnal silence.",,John A. Crow,modernism
"Mañana los poetas cantarán en divino 
verso que no logramos entonar los de hoy; 
nuevas constelaciones darán otro 
destino a sus almas inquietas con un nuevo temblor. 
Mañana los poetas seguirán su camino 
absortos en ignota y extraña floración, 
y al oir nuestro canto, con desdén repentino 
echarán a los vientos nuestra vieja ilusión. 
Y todo será inútil, y todo será en vano; 
será el afán de siempre y el idéntico arcano 
y la misma tiniebla dentro del corazón. 
Y ante la eterna sombra que surge y se retira, 
recogerán del polvo la abandonada lira 
y cantarán con ella nuestra misma canción. ","Tomorrow the poets will write in divine 
Verse that we bards of today cannot sing; 
New constellations of brilliant design
To their restless soul search a new destiny bring. 
The poets of tomorrow will write once again 
Absorbed in an unknown and exotic song,
And on hearing our words will abruptly disdain 
And reject every dream that has borne us along.
And all will be useless, and all be in vain,
There will be the same eagerness, mystery, pain, 
And the same cruel hurt we have suffered so long; 
Then before the same shadow that flits to and fro 
They will pick up the dust-covered lyre in their woe, 
And replay on its strings every note of our song.","Tomorrow the poets will sing in divine
verse that we today cannot sing;
new constellations will give another
destiny to their restless souls with a new tremor.
Tomorrow the poets will continue on their way
absorbed in unknown and strange flowering,
and upon hearing our song, with sudden disdain
They will throw our old illusion to the winds.
And everything will be useless, and everything will be in vain;
It will be the usual desire and the same arcane
and the same darkness within the heart.
And before the eternal shadow that arises and retreats,
They will collect the abandoned lyre from the dust
and they will sing our same song with her.",,John A. Crow,modernism
"Una música íntima no cesa, 
porque transida en un abrazo de oro 
la Caridad con el Amor se besa. 
¿Oyes el diapasón del corazon? 
Oye en su nota múltiple el estrépito 
de los que fueron y de los que son. 
Mis hermanos de todas las centurias 
reconocen en mí su pausa igual, 
sus mismas quejas y sus propias furias. 
Soy la fronda parlante en que se mece 
el pecho germinal del bardo druida 
con la selva por diosa y por querida. 
Soy la alberca lumínica en que nada, 
como perla debajo de una lente, 
debajo de las linfas, Scherezada. 
Y soy el suspirante cristanismo 
al hojear las bienaventuranzas 
de la virgen que fue mi catecismo. 
Y la nueva delicia, que acomoda 
sus hipnotismos de color de tango 
al figurín y al precio de la moda. 
La redondez de la Creación atrueno 
cortejando a las hembras y a las cosas 
con el clamor pagano y nazareno. 
¡Oh Psiquis, oh mi alma: suena a són 
moderno, a són de selva, a són de orgía 
y a són mariano, el són del corazón! ","An intimate music will never end
Transported here in a gold embrace
Love and Charity kiss and blend.
Don't you hear the tuning-fork of the heart?
Listen to the sound of the merry chase
Of those who were and of those who are.
My brothers of all the centuries and years
Have found in me their delayed accord,
Their harsh complaints. and their fury's tears.
I am the voice of the leaves that frisk,
The budding breast of the druid bard
With the forest as goddess and odalisque.
I am the pool where Scheherazade swims
In shining water with the ancient nudes
Like a pearl whose witness an eyeglass brims.
I am sighing Christianity sans schism
Leafing through the beatitudes
Of the Virgin who was my catechism.
And the new delight that now will ration 
The hypnotic spells that its tango sings
To the mannequin and the price of fashion.
I shout that Genesis itself is round,
And court the ladies and material things
With a very Christian and a pagan sound.
Oh, Psyche, my soul, let your music start
Today's song of forests, of orgies and art,
A song of Mary, the sound of the heart.","An intimate music does not stop,
because I passed into a golden hug
Charity kisses with Love.
Do you hear the tuning fork of the heart?
Hears the noise in its multiple notes
of those who were and those who are.
My brothers from all centuries
They recognize their pause in me the same way,
their own complaints and their own fury.
I am the talking frond in which it sways
the germinal chest of the druid bard
with the jungle as a goddess and as a beloved.
I am the luminous pool in which you swim,
like a pearl under a lens,
below the lymphs, Scherezada.
And I am the sighing Christianity
when leafing through the beatitudes
of the virgin who was my catechism.
And the new delight, which accommodates
its tango-colored hypnotisms
to the figure and the price of fashion.
The roundness of Creation thunder
courting females and things
with the pagan and Nazarene clamor.
Oh Psyche, oh my soul: it sounds like a son
modern, jungle sound, orgy sound
and the Marian sound, the sound of the heart!",,John A. Crow,modernism
"Tú me levantas, tierra de Castilla, 
en la rugosa palma de tu mano, 
al cielo que te enciende y te refresca, 
al cielo, tu amo. 
Tierra nervuda, enjuta, despejada. 
madre de corazones y de brazos, 
toma el presente en ti viejos colores 
del noble antaño. 
Con la pradera cóncava del cielo 
lindan en torno tus desnudos campos, 
tiene en ti cuna el sol y en ti sepulcro 
y en ti santuario. 
Es todo cima tu extensión redonda 
y en ti me siento al cielo levantado, 
aire de cumbre es el que se respira 
aquí, en tus páramos. 
¡Ara gigante, tierra castellana, 
a ese tu aire soltaré mis cantos, 
si te son dignos bajarán al mundo 
desde lo alto! ","In the rough palm of your hand
You lift me up, my own Castile,
To the sky that warms and refreshes your land,
To the sky, your master.
Parched, sinewy land of clear horizons,
Mother of hearts, stout arms, and ancient stories, 
Your present self takes on the coloring
Of your past glories.
Your harsh, bare fields reach up to merge
With the meadow of the sky, immense, concave;
The sun finds its cradle in you, its sanctuary, 
And then its grave.
Your vast expanse is all a mountain prairie,
In you I feel uplifted toward the sky,
It is a mountain air that is inhaled
Where your vast wastelands lie.
Altar of giants, land of Castile,
Into your air I shall send forth my songs, 
If you are pleased they'll fall to earth again
Where poetry belongs.","You lift me up, land of Castile,
in the rough palm of your hand,
to the sky that lights you up and refreshes you,
To heaven, your master.
Wiry, lean, clear land.
mother of hearts and arms,
take the present in you old colors
of the noble yesteryear.
With the concave meadow of the sky
your naked fields border around you,
The sun has a cradle in you and a tomb in you
and in you sanctuary.
It's all over your round expanse
and in you I feel the sky lifted up,
summit air is what you breathe
here, in your wastelands.
Giant plow, Castilian land,
In your air I will release my songs,
If they are worthy of you they will go down to the world
from above!",,John A. Crow,gen_1898
