orig_span,hum_trans,goog_trans,deepl_trans,translator_name,time_period
"Gasajémonos de hucia, 
que el pesar 
viénese sin le buscar. 
Gasajemos esta vida 
descruciemos del trabajo, 
quien pudiere haber gasajo 
del cordojo se despida: 
déle, déle despedida, 
que el pesar 
viénese sin le buscar. 
De los enojos huyamos 
con todos nuestros poderes, 
andemos tras los placeres, 
los pesares aburramos: 
tras los placeres corramos, 
que el pesar 
viénese sin le buscar. 
Hagamos siempre por ser 
alegres y gasajosos, 
cuidados tristes penosos 
huyamos de los tener: 
busquemos siempre el placer, 
que el pesar 
viénese sin le buscar. ","Come, let's enjoy the passing hour; 
For mournful thought
Will come unsought.
Come, let's enjoy the fleeting day. 
And banish toil, and laugh at care;
For who would grief and sorrow bear, 
When he can throw his griefs away? 
Away, away!-begone! I say;
For mournful thought 
Will come unsought.
So let's come forth from misery's cell, 
And bury all our whims and woes; 
Wherever pleasure flits and goes,
O, there we'll be! O, there we'll dwell! 
'Tis there we'll dwell! 'Tis wise and well; 
For mournful thought
Will come unsought.
Yes, open all your heart; be glad,­ 
Glad as a linnet on the tree;
Laugh, laugh away,-and merrily 
Drive every dream away that's sad. 
Who sadness takes for joy is mad; 
And mournful thought
Will come unsought.
","Let's get gassed of hucia,
that the regret
He comes without looking for him.
Let's spend this life
let's get rid of work,
who could have gauze
of the cordojo says goodbye:
say goodbye, say goodbye,
that the regret
He comes without looking for him.
Let's flee from anger
with all our powers,
let's walk after pleasures,
the regrets bore us:
Let's run after the pleasures,
that the regret
He comes without looking for him.
Let us always do to be
happy and fluffy,
sad painful care
let's flee from having:
let's always look for pleasure,
that the regret
He comes without looking for him.",,Sir John Bowring,renaissance
"Ninguno cierre las puertas 
si amor viniere a llamar, 
que no le ha de aprovechar. 
Al amor obedezcamos 
con muy presta voluntad, 
y pues es necesidad 
de fuerza virtud hagamos: 
al amor no resistamos 
nadie cierre a su llamar, 
que no le ha de aprovechar. 
Amor amansa al más fuerte 
y al más flaco fortalece, 
al que menos le obedece 
más le aqueja con su muerte 
a su buena o mala suerte: 
nadie debe repugnar, 
que no le ha de aprovechar. 
Amor muda los estados 
las vidas y condiciones, 
conforme los corazones 
de los bien enamorados: 
resistir a sus cuidados 
nadie debe procurar, 
que no le ha de aprovechar. 
Aquel soberano amor 
que se pinta niño y ciego, 
hace al pastor palaciego 
y al palaciego pastor: 
contra su pena y dolor 
ninguno debe lidiar, 
que no le ha de aprovechar. 
El que es amor verdadero 
despierta al enamorado, 
hace el medroso esforzado 
y muy pulido al grosero: 
quien es de amor prisionero 
no salga de du mandar, 
que no le ha de aprovechar. ","Don't shut your door.-don't shut your door:
If Love should come and call, 
'T will be no use at all.
If Love command, you'd best obey,­ 
Resistance will but hurt you,-
And make, for that's the safest way,
Necessity a virtue.
So don't resist his gentle sway,
Nor shut your door if he should call,­ 
For that's no use at all.
I've seen him tame the wildest beast, 
And strengthen, too, the weakest:
He loves him most who plagues him least;
His favorites are the meekest.
The privileged guests who grace his feast 
Have ne're opposed his gentle call,
- For that's no use at all.
He loves to tumble upside down 
All classes, all connections;
Of those who fear or wear a crown 
He mingles the affections,
Till all by Love is overthrown; 
And moated gate or castle-wall 
Will be no use at all.
He is a strange and wayward thing,­ 
Young. blind, and full of malice;
He makes a shepherd of a king,
A cottage of a palace.
'T is vain to murmur; and to fling 
Your thoughts away in grief and gall 
Will be no use at all.
He makes the coward brave, he wakes 
The sleepy with his thunders;
In mirth he revels, and mistakes, 
And miracles, and wonders;
And many a man he prisoner makes, 
And bolts the door:-you cry and call; 
But 't is no use at all.
","No one closes the doors
If love came calling,
that it should not take advantage of him.
Let us obey love
with very willing will,
and so it is necessary
of strength virtue let's do:
let's not resist love
no one closes his knock,
that it should not take advantage of him.
Love tames the strongest
and strengthens the weakest,
the one who obeys the least
his death bothers him the most
to your good or bad luck:
no one should be disgusted,
that it should not take advantage of him.
Love changes the states
the lives and conditions,
according to the hearts
of those in love:
resist their care
no one should try,
that it should not take advantage of him.
That sovereign love
who paints himself as a boy and blind,
makes the shepherd palatial
and to the palatial shepherd:
against your sorrow and pain
no one must deal,
that it should not take advantage of him.
The one who is true love
wake up the lover,
makes the fearful strong
and very polished to the rude:
who is a prisoner of love
do not go out of your command,
that it should not take advantage of him.",,Sir John Bowring,renaissance
"¡Sañosa está la niña! 
¡Ay, Dios!, ¿quién le hablaría? 
En la sierra anda la niña 
su ganado a repastar, 
hermosa como las flores, 
sañosa como la mar. 
Sañosa como la mar 
está la niña. 
¡Ay, Dios!, ¿quién le hablaría? ","She is wild! She is wild! 
Who will speak to the child? 
On the hills pass her hours, 
As a shepherdess free;
She is fair as the flowers, 
She is wild as the sea!
She is wild! She is wild! 
Who will speak to the child?
 













","The girl is vicious!
Oh, God, who would talk to him?
The girl walks in the mountains
his cattle to graze,
beautiful like flowers,
vicious like the sea.
Vicious as the sea
there is the girl
Oh, God, who would talk to him?",,Goerge Ticknor,renaissance
"Dicen que me case yo. 
no quiero marido, no. 
Más quiero vivir segura 
n'esta sierra a mi soltura 
que no estar en ventura 
si casaré bien o no. 
Dicen que me case yo: 
no quiero marido, no, 
Madre, no seré casada 
por no ver vida cansada, 
y quizá mal empleada l
a gracia que Dios me dio. 
Dicen que me case yo: 
no quiero marido, no. 
No será ni es nacido 
tal para ser mi marido; 
y pues que tengo sabido 
que la flor yo me la só, 
dicen que me case yo: 
no quiero marido, no. ","They say they'll to my wedding go; 
But I will have no husband-no!
I'll rather live serene and still 
Upon a solitary hill,
Then bend me to another's will, 
And be a slave in weal or woe:
No!1 will have no husband-no!
No! mother! I've no wish to prove 
The doubtful joys of wedded love­
And from those flowery pathways rove 
Where innocence and comfort grow­ 
No! I will have no husband-no!
And heaven, I'm sure, ne'er meant that he 
Should thy young daughter's husband be: 
We have no common sympathy-
So let youth's bud unbroken blow­ 
For I will have no husband-no!
","They say I got married.
I don't want a husband, no.
I want to live more safely
in this mountain range at my ease
than not to be in luck
whether I will marry well or not.
They say I got married:
I don't want a husband, no,
Mother, I will not be married
for not seeing a tired life,
and perhaps misused
to the grace that God gave me.
They say I got married:
I don't want a husband, no.
It will not be nor is it born
such to be my husband;
and well, what do I know?
that I know the flower,
They say I'm getting married:
I don't want a husband, no.",,Sir John Bowring,renaissance
"Muy graciosa es la doncella 
¡cómo es bella y hermosa! 
Digas tú, el marinero 
que en las naves vivías, 
si la nave o la vela o la estrella 
es tan bella. 
Digas tú, el caballero 
que las armas vestías, 
si el caballo o las armas o la guerra 
es tan bella. 
Digas tú, el pastorcico 
que el ganadico guardas, 
si el ganado o los valles o la sierra 
es tan bella. ","Fair is the maiden, who can be 
As fair and beautiful as she?
Sailor, tell me from your ship 
That sails the boundless sea,
ls there ship, or sail, or star 
As beautiful as she?
Knight in shining armor clad, 
O, did you ever see
Palfrey, arms, or battlefield 
As beautiful as she?
Shepherd, as you guard your flock, 
Tell me, could there be
Meadow, flock, or mountain range 
As beautiful as she?
","The maiden is very graceful
how beautiful and beautiful she is!
You say, the sailor
that you lived in the ships,
whether the ship or the sail or the star
is so beautiful.
You say, the knight
that the weapons you wore,
whether the horse or the weapons or the war
is so beautiful.
You say, the shepherd
that the cattle keep,
whether the cattle or the valleys or the mountains
is so beautiful.",,John A. Crow,renaissance
"Alguna vez, 
O pensamiento, 
serás contento. 
Si amor cruel 
me hace guerra, 
seis pies de tierra 
podrán más que él: 
allí sin él 
y sin tormento, 
serás contento. 
Lo no alcanzado 
en esta vida, 
ella perdida 
será hallado, 
y sin cuidado 
del mal que siento, 
serás contento. ","Some day, some day, 
O troubled breast, 
Shalt thou find rest. 
If Love in thee
To grief give birth, 
Six feet of earth 
Can more than he;
There calm and free, 
And unoppressed, 
Shalt thou find rest. 
The unattained
In life at last,
When life is passed, 
Shall all be gained; 
And no more pained, 
No more distressed, 
Shalt thou find rest.








","Ever,
Or thought,
you will be happy.
Yes cruel love
makes me war,
six feet of land
They will be able to do more than him:
there without him
and without torment,
you will be happy.
The not achieved
in this life,
she lost
will be found,
and without care
of the evil that I feel,
you will be happy.",,Henry Wadsworth Longfellow,renaissance
"En la peña y sobre la peña 
duerme la niña y sueña. 
La niña que amor había 
de amores se trasportaba; 
con su amigo se soñaba, 
soñaba, mas no dormía; 
que la dama enamorada, 
y en la peña, 
no se duerme si amores sueña. 
El corazón se le altera 
con el sueño en que se vio; 
si no vio lo que soñó soñó 
lo que ver quisiera; 
hace representación
en la peña 
de todo el sueño que sueña. 
Sueños son que, amor, envías 
a los que traes desvelados, 
pagas despiertos cuidados 
con fingidas alegrías; 
quien muere de hambre los días, 
de noche manjares sueña, 
suso la peña. 
 
","On a rock where the moonlight gleam'd, 
The maiden slept, and the maiden dream'd.
The maiden dream'd, for love had crept 
Within her thoughtless heart, and seem'd 
To picture him of whom she dream'd.
She dream'd,-and did I say she slept?
O no! her brain with visions teem'd: 
The maiden on the rocky ground
Sleeps not, if love's wild dreams flit round.
Her heart's perplex'd by mystery,
And passing shades, and misty gleams 
And if she see not what she dreams
She dreams of what she fain would see
And 'tis her woe estranged to be,        
While on the rocky mountain laid, 
From all that cheers a love-sick maid.
And what is love, but dreams which thought, 
Wild thought carves out of passion? throwing 
Its veil aside, while, wing'd and growing,
The embryo's to existence brought,
False joys, fierce cares, with mysteries fraught; 
As who by day of hunger dies,
Dreaming of feasts at midnight lies.
","In the rock and on the rock
The girl sleeps and dreams.
The girl who loved
of loves he transported himself;
He dreamed of his friend,
I dreamed, but I did not sleep;
that the lady in love,
and on the rock,
You don't sleep if love dreams.
Your heart breaks
with the dream in which he saw himself;
If you didn't see what you dreamed, you dreamed
what I would like to see;
makes representation
on the rock
of all the dream you dream.
Dreams are that, love, you send
those you keep awake,
you pay awake care
with feigned joys;
who dies of hunger every day,
at night delicacies dream,
I use the rock.
 
",,Sir John Bowring,renaissance
"Hace el amor lo que quiere, 
¡mas ay! que no lo que debe. 
Ha dado amor en gustar 
de verme amando morir, 
y ansí me hace sufrir 
cuantos males puede dar: 
hace su gusto en buscar 
con que mi paciencia pruebe: 
¡mas ay! que no lo que debe. 
Ni hay mal ni desasosiego 
con que deje de ofenderme, 
y en llegando a deshacerme 
vuelve a repararme luego: 
hace que con su fuego 
como fénix me renueve, 
¡mas ay! que no lo que debe. 
Debiera al menos un día, 
pues me quiere atormentar, 
para aliviarme en penar 
darme una hora de alegría: 
mas no lo hace, y porfía: 
en hacer mi vida breve, 
¡mas ay! que no lo que debe. 
Ninguno con más cuidado 
sus banderas ha seguido, 
y en premio de lo servido 
dejándome bien pagado, 
hace por su desenfado 
que tan dura carga lleve
¡mas ay! que no lo que debe
","Love does whate'er he likes, 'tis true, 
But never what he ought to do.
It is, I find, his royal will
That I, o'erpower'd by love, should die, 
And so 'tis his delight to fill
My cup with varied misery:
He tries my heart with every ill 
That mortal patience ever knew, 
Which surely he ought not to do!
There is no grief, there is no pain, 
Which he inflicts not: when I fall 
Subdued, he rouses me again, 
And but to visit me with all
That ever bid a heart complain:
His embers do his birth renew, 
Which, surely, they need not to do!
It would become him well to give,
For sorrows deep, and sufferings long, 
One gleam of joy, one short reprieve,
One thought of bliss 'midst misery's throng. 
But no! he flies the alternative,
And throws again the bolts he threw:­ 
He does not what he ought to do.
And ne'er a more obedient slave 
Follow'd his banners; never one
Had higher claim, or ought to have­ 
What service wrought, what duties done, 
What toils on shore, and risks on wave!
He does whate'er he will, 'tis true, 
But never what he ought to do!
","Love does what it wants,
but oh! that not what it should.
He has given love to taste
to see myself loving to die,
and so it makes me suffer
How many harms can it cause?
he likes to search
with which my patience tests:
but oh! that not what it should.
There is neither evil nor restlessness
so you can stop offending me,
and coming to undo
repair me again later:
does that with his fire
like a phoenix renew me,
but oh! that not what it should.
Should at least a day,
because he wants to torment me,
to alleviate my pain
give me an hour of joy:
but he doesn't do it, and stubbornly:
in making my life short,
but oh! that not what it should.
None with more care
their flags has followed,
and in reward for what was served
leaving me well paid,
does for his ease
how hard a burden it carries
but oh! that not what it should
",,Sir John Bowring,renaissance
"La sierra es alta 
y áspera de subir; 
los caños corren agua 
y dan en el toronjil. 
Madre, la mi madre 
de cuerpo atán garrido, 
por aquella sierra 
de aquel lomo erguido 
iba una mañana 
el mi lindo amigo; 
llaméle con mi toca 
y con mis dedos cinco... 
Los caños corren agua 
y dan en el toronjil. ","The mountain towers with haughty brow, 
Its paths deserted be;
The streamlets through their currents flow,
And wash the mallows-tree.
O mother mine! O mother mine! 
That youth so tall and fair,	.
With lips that smile, and eyes that shine,
I saw him wandering there:
I saw him there when morning's glow 
Was sparkling on the tree,-
With my five fingers, from below, 
I beckoned, ""Come to me!""
The streamlets through their currents flow,
And wash the mallows-tree.
","The mountain is high
and rough to climb;
the pipes run water
and they hit the lemon balm.
Mother, my mother
with a tanned body,
through that mountain
of that upright back
I was going one morning
my beautiful friend;
I called him with my touch
and with my five fingers...
The pipes run water
and they hit the lemon balm.",,Sir John Bowring,renaissance
"Fertiliza tu vega, 
dichoso Tormes, 
porque viene mi niña 
cogiendo flores. 
De la fértil vega 
y el estéril bosque 
los vecinos campos 
maticen y broten 
lirios y claveles 
de varios colores 
porque viene mi niña 
cogiendo flores 
Vierta el alba perlas 
desde sus balcones 
que prados amenos 
maticen y borden; 
y el sol envidioso 
pare el rubio coche; 
porque viene mi niña 
cogiendo flores.
El céfiro blando 
sus yerbas retoce 
y en las frescas ramas 
claros ruiseñores 
saludan el día 
con sus dulces voces; 
porque viene mi niña 
cogiendo flores. 
 
","Thou happy vale of Tormes, 
Grow rich with sunny showers;
For my little maiden cometh, 
She comes to gather flowers!
Let mirth be in thy forest, 
And wealth upon thy plain;
Let all thy fragrant meadows 
Burst forth to life again,
With the ruddy pink and iris,
All fresh with summer showers; 
For my little maiden cometh,
She comes to gather flowers!
Let all the grasses glisten 
With pearly drops of dew;
Let all thy gardens sparkle 
With gems of every hue;
The sun drive forth his chariot, 
With all the rosy hours;
For my little maiden cometh, 
She comes to gather flowers!
Bend, bend your heads, ye bushes, 
Beneath the gentle gales;
Pipe forth from every thicket, 
Ye tuneful nightingales;
To greet the day that dawneth, 
And gladden all the bowers;
For my little maiden cometh, 
She comes to gather flowers!
 





","Fertilize your meadow,
blessed Tormes,
because my girl is coming
picking flowers
From the fertile plain
and the barren forest
the neighboring fields
nuance and sprout
lilies and carnations
pied
because my girl is coming
picking flowers
Pour the dawn pearls
from their balconies
what pleasant meadows
nuance and border;
and the envious sun
stop the blonde car;
because my girl is coming
picking flowers
The soft zephyr
its herbs frolic
and in the fresh branches
clear nightingales
greet the day
with their sweet voices;
because my girl is coming
picking flowers
 
",,James Young Gibson,renaissance
"Galeritas de España 
parad los remos, 
para que descanse 
mi amado preso. 
Galeritas nuevas 
que en el mar soberbio 
levantáis las olas 
de mi pensamiento; 
pues el viento sopla 
navegad sin remos 
para que descanse 
mi amado preso. 
En el agua fría 
encendéis mi fuego, 
que un fuego amoroso 
arde entre los hielos; 
quebrantad las olas 
y volad con viento 
para que descanse 
mi amado preso. 
Plegue a Dios que deis 
en peñascos recios, 
defendiendo el paso 
de un lugar estrecho; 
y que estéis parados 
sin temer encuentro 
para que descanse 
mi amado preso. 
Plegue a Dios que os manden 
pasar el invierno 
ocupando el paso 
de un lugar estrecho; 
y que quebrantados 
os volváis al puerto, 
para que descanse 
mi amado preso. 
","Ye galleys of our land 
Arrest your oars again,
That he, my love, may rest, 
Who drags your heavy chain.
Bright galleys! on the surge 
Ye bear with every stroke,
The surges of my thoughts, 
Which fear and love awoke.
Upon the ocean's breast
Its fair winds move again; 
So let my lover rest
Who drags your heavy chain.
The waters of the sea
Though cold, inflame my soul; 
My love's pure light would glow
E'en at the icy pole.
That love on whirlwind's breast 
Would fly across the main,
To let my lover rest
Who drags your heavy chain.
O wait! bright galleys now, 
In some fair harbour wait,
Or guard the narrow pass
Of some not-distant strait; 
Or, at the maid's behest,
In tranquil port remain, 
That he, my love, may rest,
Who drags your heavy chain.
The winter hours draw night 
Come, galleys, then, and stay,
In cheerful solitude,
Within a sheltered bay 
There ye may anchor rest,
For there no dangers reign­ 
So let my lover rest
Who drags your heavy chain.
","Galleries from Spain
stop the oars,
to relax
my beloved prisoner.
new galleries
that in the superb sea
you raise the waves
of my thoughts
because the wind blows
sail without oars
to relax
my beloved prisoner.
In the cold water
you light my fire,
than a loving fire
burns among the ice;
break the waves
and fly with the wind
to relax
my beloved prisoner.
Pray to God that you give
on strong rocks,
defending the pass
from a narrow place;
and that you are standing
without fearing encounter
to relax
my beloved prisoner.
Pray to God that they send you
spend the winter
occupying the step
from a narrow place;
and how broken
you return to the port,
to relax
my beloved prisoner.
",,Sir John Bowring,renaissance
"Mucho ha que el alma duerme, 
bien será que recuerde. 
Duerme sueño tan pesado 
que como muerta cayó 
fuego que la adormeció 
el veneno del pecado: 
y pues el sol deseado 
en los ojos ya le hiere, 
bien será que recuerde. 
Si ángeles no han podido 
despertarla con cantar, 
despierte, oyendo llorar 
a Dios por ella nacido: 
muy larga noche ha dormido, 
y pues tal día le viene, 
bien será que recuerde.
","Long  sleep has veiled my spirit's eyes: 
Tis time to rise! 'tis time to rise!
O, 'tis a dull and heavy sleep!
As if death's robe had wrapped the soul;
As if the poisons, vices steep
In life's deep-dregged and mingled bowl, 
Had chilled the blood, and dimmed the eyes: 
But, lo! the sun towers o'er the deep:
'Tis time to rise!-'tis time to rise!
But angels sang in vain,-above 
Their voices blended: ""Soul, awake!
Hark to yon babe!-what wondrous love 
Bids God an infant's weakness take!­ 
Long hast thou slept,-that infant's cries 
Shall the dark mist of night remove:
'Tis time to rise!-'tis time to rise!""
","The soul has been sleeping for a long time,
You'd better remember.
Sleep so heavy sleep
that fell like dead
fire that lulled her to sleep
the poison of sin:
and then the desired sun
It already hurts his eyes,
You'd better remember.
If angels have not been able
wake her up with singing,
wake up, hearing cry
to God born by her:
He slept very long night,
and then such a day comes,
You'd better remember.
",,Sir John Bowring,renaissance
"Castillo, dáteme, date, 
sino dártehe yo combate. 
Castillo de alto cimiento 
adó está mi pensamiento, 
procede de ti el contento 
que el corazón arrebate: 
sino dártehe yo combate. 
Castillo hermoso y dorado 
do aposenta mi cuidado, 
muéstrame tu puente o vado 
por dar a mis penas mate, 
sino dártehe yo combate. 
Castillo de gran altura 
dechado de la hermosura, 
pues en ti está mi ventura 
sus tiros y armas abate, 
sino dártehe yo combate. 
","Yield, thou castle! yield!- 
I march me to the field.
Thy walls are proud and high, 
My thoughts all dwell with thee; 
Now yield thee! yield thee!- I
Am come for victory;
I march me to the field.
Thy halls are fair and gay, 
And there resides my grief; 
Thy bridge, thy covered way, 
Prepare for my relief;
I march me to the field.
Thy towers sublimely rise 
In beauty's brightest glow;
There, there, my comfort lies.- 
O, give me welcome now!
I march me to the field.
","Castillo, give me, give me,
but I will give you combat.
High foundation castle
here is my thought,
happiness comes from you
that the heart captures:
but I will give you combat.
Beautiful and golden castle
where my care rests,
show me your bridge or ford
for giving my sorrows mate,
but I will give you combat.
high-rise castle
paragon of beauty,
because my happiness is in you
their shots and weapons knock down,
but I will give you combat.
",,Sir John Bowring,renaissance
"Mientras duerme mi niña, 
céfiro alegre, 
sopla más quedito, 
no la recuerdes. 
Sopla manso viento 
al sueño suave, 
que enseña a ser grave 
con su movimiento; 
dale el dulce aliento 
que entre perlas finas 
a gozar caminas 
y ufano vuelves; 
sopla más quedito, 
no la recuerdes. 
Mira no despierte 
del sueño en que duerme, 
que temo que el verme 
causará mi muerte. 
¡Dichosa tal suerte! 
¡Venturosa estrella 
si a niña tan bella 
alentar mereces! 
Sopla más quedito, 
no la recuerdes. ","While my lady sleepeth, 
Zephyr, gently blow:
Wake her not, I pray thee, 
Lest she wake to woe.
Gently blow, gay Zephyr! 
Noiseless be thy tread­
Glide on wings of silence 
O'er her slumbering head.
Breathe as though the pearl-drops 
Hung on twilight's bed,
Where thy touch would linger 
As thy breezes blow.
Wake her not, I pray thee, 
Lest she wake to woe.
Wake her not - she slumbers­ 
Peace is on her breast.
O, would I deprive her 
Of one dream of rest?
No!-but how I envy, 
How I deem thee blest,
Who, my gentle lady, 
Softly cradles so.
Wake her not, I pray thee, 
Lest she wake to woe.

","While my girl sleeps,
joyful zephyr,
blow quieter,
don't remember her.
Gentle wind blows
to soft sleep,
that teaches to be serious
with its movement;
give him sweet breath
that between fine pearls
you walk to enjoy
and proud you return;
blow quieter,
don't remember her.
Look don't wake up
of the dream in which he sleeps,
that I fear that seeing me
will cause my death.
Such luck!
blessed star
yes such a beautiful girl
encourage you deserve!
Blow quieter,
don't remember her.",,Sir John Bowring,renaissance
