orig_span,hum_trans,goog_trans,deepl_trans,translator_name,time_period
"¿Qué farayu o qué serád de mibi? 
Habibi, 
non te tolgas de mibi. 

Vayse meu corachón de mib, 
¿ya, Rab, si se me tornarád? 
¡Tan mal meu dolor li-l-habib! 
Enfermo yed, ¿cuándo sanarád? 

Tant' amare, tanť amáre, 
habib, tant' amáre, 
enfermaron uelios gaios, 
e dolen tan male. 

¿Qué faré, mamma? 
Meu-l-habib est' ad yana. ","What shall I do? What will become of me? 
Oh, my beloved, 
Do not abandon me now! 

My heart is going away from me,
Oh, God, when will it return? 
So great is the grief for my beloved! 
For he is ill, when will he be well? 

So much love, so much love, 
Oh, sweetheart, so much love; 
Eyes that were gay are now ill, 
And hurt most cruelly. 
Oh, mother, what shall I do?
My beloved is at the door. 
","What farayu or what will become of mibi?
Habibi,
Don't worry about mibi.

Vayse my heart of mib,
Now, Rab, will you turn to me?
So bad my pain li-l-habib!
You are sick, when will you recover?

Tant' amare, tanť amare,
habib, so much love,
Ulios Gaios fell ill,
and they hurt so bad.

What will I do, mom?
Meu-l-habib est' ad yana.",,anon,med
"De los sos ojos tan fuertemientre llorando, 
tornava la cabeça e estávalos catando. 
Vío puertas abiertas e uços sin cañados, 
alcándaras vázias sin pielles e sin mantos 
e sin falcones e sin adtores mudados. 
Sospiró mio Çid, ca mucho avié grandes cuidados. 
Fabló mio Çid bien e tan mesurado: 
""¡grado a ti señor padre, que estás en alto! 
""Esto me an buolto mios enemigos malos.” 
Allí pienssan de aguijar, allí sueltan las riendas. 
A la exida de Bivar ovieron la corneja diestra, 
e entrando a Burgos oviéronla siniestra. 
Meçió mio Çid los ombros y engrameó la tiesta: 
""albricia, Álvar Fáñez, ca echados somos de tierra! 
""mas a grand ondra tornaremos a Castiella.” 

Mio Çid Roy Díaz, por Burgos entróve, 
en sue conpaña sessaenta pendones; 
exien lo veer mugieres e varones, 
burgeses e burgessas, por las finiestras sone, 
plorando de los ojos, tanto avien el dolore. 
De las sus bocas todos dizían una razóne: 
“Dios, qué buen vassallo, si oviesse buen señore!"" 
Conbidar le ien de grado, mas ninguno non osava:
el rey don Alfonsso tanto avie le grand saña.
Una niña de neuf años a ojo se parava: ""
Ya Campeador, en buena çinxiestes espada! 
“ΕΙ rey lo ha vedado, anoch dél entró su carta, 
""con grant recabdo e fuertemientre seellada. 
""Non vos osariemos abrir nin coger por nada; 
""si non, perderiemos los averes e las casas, 
""e aun demás los ojos de las caras. 
""Çid, en el nuestro mal vos non ganades nada; 
""mas el Criador vos vala con todas sus vertudes santas."" 
Esto la niña dixo e tornós pora su cosa. 
Ya lo vede el Çid que del rey non avie gracia. 

La oración fecha, la missa acabada la an, 
salieron de la eglesia, ya quieren cavalgar. 
El Çid a doña Ximena ívala abraçar; 
doña Ximena al Çid la manol va besar, 
llorando de los ojos, que non sabe qué se far. 
E él a las niñas tornólas a catar: 
""a Dios vos acomiendo e al Padre spirital
""agora nos partimos, Dios sabe el ajuntar.”
Llorando de los ojos, que non vidiestres atal, 
assís parten unos d'otros commo la uña de la carne. ","His eyes flooding with bitter tears, the Cid concealed his face, 
He turned his head for one last look at his sweet dwelling place; 
He saw the heavy doors ajar, the postern gate unbolted, 
Bare perches where his skins had hung, and where his falcons molted. 
His heart was sad, he heaved a sigh, in measured words he said: 
""O blessed Father in the sky, Lord of the quick and dead, 
See what my enemies have done to me; the King has been misled."" 
They spurred their mounts, then dropped the reins they had been holding tight, 
Leaving Bivar a bird of hope flew singing on their right, 
But near Burgos a baleful crow hove leftward into sight. 
The Cid looked up, he grimly shrugged and turned his head aside, 
""Take heart with me Alvar, old friend,"" these words he proudly cried, 
""While we are now cast from the land where all our kin reside, 
Castile will yet hail our return, or claim us when we've died."" 
The Cid rode into Burgos then with sixty lances strong, 
And men and women sallied forth to greet the passing throng, 
While other townsfolk gazed at them from windows all along, 
They wept in anguish at the sight and cried with one accord: 
""God, what a vassal he would make, if he had a good lord!"" 
They gladly would have sheltered him, but dared not disregard 
The edict that the King had sent, which all of them abhorred. 

A little girl of nine came out to where the Cid's horse stood, 
""O Campeador of honored sword, we'd open if we could; 
Last night the king's decree arrived closing our doors to you, 
By herald and well sealed it came to prove its message true, 
And so we dare not open up despite our angry cries, 
We'd lose our homes and our estates, even our very eyes. 
Cid, do not trespass on our plight, if by mischance you should, 
Then you would wrong us grievously, and do yourself no good, 
But God attend you where you go, this much we all implore!"" 
So spoke the girl and went inside and locked the heavy door; 
The Cid then knew his royal sire would favor him no more. 

The prayer and mass were spoken to start them on their way,
They left the church and mounted, but how they longed to stay, 
The Cid embraced Jimena, his hand that round her lay 
She lifted gently to her lips, and sobbed in her dismay, 
He turned and kissed his daughters, and to them softly said: 
""May God the Father guard you, His grace upon you shed, 
At last the time to leave has come, the parting that I dread. 
God willing we will meet again, but now our travails start.' 
They wiped the tears away once more, but still grieved in the heart, 
Then like nail that leaves the flesh, they tore themselves apart
","From your eyes so strong while crying,
He turned his head and was tasting them.
I saw open doors and uços without ravines,
empty alcándars without skins and without cloaks
and without falcons and without changed adtors.
My Çid sighed, I took great care.
My Çid spoke well and so measured:
""Thank you sir father, you are on high!
""This has brought me back, my evil enemies.""
There they think of prodding, there they let go of the reins.
At Bivar's exit they heard the right-handed crow,
and entering Burgos they saw the sinister thing.
My Çid shook his shoulders and greased the pot:
""Albricia, Álvar Fáñez, we are fallen from the ground!
""but at great wave we will return to Castiella.""

My Çid Roy Díaz, by Burgos entranceve,
in his company sixty banners;
Exien see it women and men,
burgesses and burgesses, for the sone holidays,
crying out of the eyes, so much pain relief.
From their mouths everyone said a reason:
“God, what a good vassal, si oviesse good sir!”
He welcomed him willingly, but no one dared:
King Don Alfonsso loved him so much.
A new-year-old girl stopped by the eye: ""
Already Campeador, in good çinxiestes sword!
“The king has forbidden him, last night his letter came in,
""with grant collected and strongly sealed.
""We wouldn't dare open or take it for anything;
""If not, we would lose the birds and the houses,
""and even more the eyes of the faces.
""Çid, in our evil you gain nothing;
""but the Creator values ​​you with all his holy virtues.""
This the girl said and went back to her thing.
The Çid already sees that the king has no favor.

The prayer date, the mass finished the an,
They left the church, they already want to ride.
El Çid hugged Doña Ximena;
Doña Ximena al Çid the hand is going to kiss,
crying from his eyes, he doesn't know what he's doing.
And he took the girls back to taste:
""I commend you to God and to the spiritual Father
""Now we are parting, God knows how to put it together.""
Crying from the eyes, that you don't see atal,
Thus they split from each other like the nail of flesh.",,John A. Crow,med
